### ISSUE TITLE
Error on Windows 10

### ISSUE THREAD

**Issue by dengqf6** [cifsd-team/cifsd#104]
Windows 10 18362.145, Linux kernel 4.19.49
Using the example config in openwrt/packages#9155
LAN IP is `10.0.0.1/24`
Try accessing `\\10.0.0.1`, Windows gives `0x80070043` (The network name cannot be found) error. No packet to TCP port 445 is seen
Try accessing `\\10.0.0.1\testshare`, Windows gives `0x80004005` (Unspecified error). This time some packets are captured:
```
IP 10.0.0.105.50123 > 10.0.0.1.445: Flags [S], seq 4110943205, win 64240, options [mss 1460,nop,wscale 8,nop,nop,sackOK], length 0
IP 10.0.0.1.445 > 10.0.0.105.50123: Flags [S.], seq 987606738, ack 4110943206, win 29200, options [mss 1460,nop,nop,sackOK,nop,wscale 6], length 0
IP 10.0.0.105.50123 > 10.0.0.1.445: Flags [.], ack 1, win 8212, length 0
IP 10.0.0.105.50123 > 10.0.0.1.445: Flags [P.], seq 1:229, ack 1, win 8212, length 228 SMB-over-TCP packet:(raw data or continuation?)
IP 10.0.0.1.445 > 10.0.0.105.50123: Flags [.], ack 229, win 473, length 0
IP 10.0.0.1.445 > 10.0.0.105.50123: Flags [P.], seq 1:259, ack 229, win 473, length 258 SMB-over-TCP packet:(raw data or continuation?)
IP 10.0.0.105.50123 > 10.0.0.1.445: Flags [P.], seq 229:395, ack 259, win 8211, length 166 SMB-over-TCP packet:(raw data or continuation?)
IP 10.0.0.1.445 > 10.0.0.105.50123: Flags [.], ack 395, win 490, length 0
IP 10.0.0.1.445 > 10.0.0.105.50123: Flags [P.], seq 259:504, ack 395, win 490, length 245 SMB-over-TCP packet:(raw data or continuation?)
IP 10.0.0.105.50123 > 10.0.0.1.445: Flags [P.], seq 395:915, ack 504, win 8210, length 520 SMB-over-TCP packet:(raw data or continuation?)
IP 10.0.0.1.445 > 10.0.0.105.50123: Flags [P.], seq 504:590, ack 915, win 507, length 86 SMB-over-TCP packet:(raw data or continuation?)
IP 10.0.0.105.50123 > 10.0.0.1.445: Flags [R.], seq 915, ack 590, win 0, length 0
...(This pattern of packets repeats several times before Windows gives errors)
```

**Comment by namjaejeon** [comment]
Hi,

Could you please share wireshark dump on windows client ?
It will be helpful to find root-cause.

Thanks!

**Comment by namjaejeon** [comment]
Could you please help us fix this issue ? We need tcpdum or wireshark to analyse this issue ?

**Comment by namjaejeon** [comment]
No response, So close.

**Comment by dengqf6** [comment]
Reinstalled Windows 10 and cifsd latest version, now it works

**Comment by namjaejeon** [comment]
Oh!,,, okay, Thanks for your testing!
Could you confirm our reply of mixplorer issue ?

**Comment by ysc3839** [comment]
@namjaejeon I have the same problem.
Windows Version 10.0.18362.295, cifsd running on OpenWrt router, Linux 4.14.145.
Open `\\192.168.1.1` on Windows, got `Error code: 0x80004005 Unspecified error`.

Here is wireshark capture, filtered with `tcp.port==445`:
[cifsd.pcapng.gz](https://github.com/cifsd-team/cifsd/files/3692092/cifsd.pcapng.gz)

**Comment by namjaejeon** [comment]
Thanks for your report!
I will check your dump.

**Comment by namjaejeon** [comment]
@ysc3839 I fixed. Could you please check your issue with the latest master ?
Thanks!

**Comment by ysc3839** [comment]
@namjaejeon Tested. Now It works.

**Comment by namjaejeon** [comment]
Thanks for your test!
